{
  "$schema": "https://json-schema.org/draft/2020-12/schema",
  "$id": "https://edam.spec/evidence-segment-manifest-1.0.schema.json",
  "title": "Evidence Segment Manifest v1",
  "type": "object",
  "required": ["manifest_version","segment_id","db_id","engine","segment_sequence",
               "opened_at","sealed_at","event_count","first_envelope_id","last_envelope_id",
               "first_row_hash","last_row_hash","object_list","object_hash_list",
               "source_offset_range","fidelity_summary","completeness_summary",
               "previous_segment","manifest_hash"],
  "additionalProperties": false,
  "properties": {
    "manifest_version": { "type": "string", "const": "evidence-segment-manifest-1.0" },
    "segment_id": { "type": "string", "minLength": 1 },
    "db_id": { "type": "string", "minLength": 1 },
    "engine": { "type": "string", "enum": ["mysql","mariadb","postgres","sqlserver","oracle","mongodb"] },
    "segment_sequence": { "type": "integer", "minimum": 0 },
    "opened_at": { "type": "string", "format": "date-time" },
    "sealed_at": { "type": "string", "format": "date-time" },
    "event_count": { "type": "integer", "minimum": 1 },
    "first_envelope_id": { "type": "string", "format": "uuid" },
    "last_envelope_id": { "type": "string", "format": "uuid" },
    "first_row_hash": { "type": "string", "pattern": "^sha256:[0-9a-f]{64}$" },
    "last_row_hash": { "type": "string", "pattern": "^sha256:[0-9a-f]{64}$" },
    "object_list": {
      "type": "array", "minItems": 1,
      "items": {
        "type": "object",
        "required": ["seq","object_id","worm_object_key","object_type"],
        "additionalProperties": false,
        "properties": {
          "seq": { "type": "integer", "minimum": 0 },
          "object_id": { "type": "string", "format": "uuid" },
          "worm_object_key": { "type": "string", "minLength": 1 },
          "object_type": { "type": "string", "enum": ["cce","execution_result","db_audit_event"] }
        }
      }
    },
    "object_hash_list": {
      "type": "array", "minItems": 1,
      "items": {
        "type": "object",
        "required": ["seq","event_hash","row_hash"],
        "additionalProperties": false,
        "properties": {
          "seq": { "type": "integer", "minimum": 0 },
          "event_hash": { "type": "string", "pattern": "^sha256:[0-9a-f]{64}$" },
          "row_hash": { "type": "string", "pattern": "^sha256:[0-9a-f]{64}$" }
        }
      }
    },
    "source_offset_range": {
      "type": "object",
      "required": ["first_offset_key","last_offset_key"],
      "additionalProperties": false,
      "properties": {
        "first_offset_key": { "type": "string" },
        "last_offset_key": { "type": "string" },
        "consumed_gtid_set": { "type": "string" }
      }
    },
    "fidelity_summary": {
      "type": "object",
      "required": ["all_healthy","degraded_count","compromised_count"],
      "additionalProperties": false,
      "properties": {
        "all_healthy": { "type": "boolean" },
        "degraded_count": { "type": "integer", "minimum": 0 },
        "compromised_count": { "type": "integer", "minimum": 0 },
        "reasons": { "type": "array", "items": { "type": "string" } }
      }
    },
    "completeness_summary": {
      "type": "object",
      "required": ["gap_detected","expected_continuous"],
      "additionalProperties": false,
      "properties": {
        "gap_detected": { "type": "boolean" },
        "expected_continuous": { "type": "boolean" },
        "notes": { "type": "array", "items": { "type": "string" } }
      }
    },
    "previous_segment": {
      "type": ["object","null"],
      "additionalProperties": false,
      "properties": {
        "segment_id": { "type": "string" },
        "segment_sequence": { "type": "integer", "minimum": 0 },
        "segment_hash": { "type": "string", "pattern": "^sha256:[0-9a-f]{64}$" }
      }
    },
    "manifest_hash": { "type": "string", "pattern": "^sha256:[0-9a-f]{64}$" }
  },
  "allOf": [
    { "if": { "properties": { "segment_sequence": { "const": 0 } } },
      "then": { "properties": { "previous_segment": { "const": null } } },
      "else": { "properties": { "previous_segment": { "type": "object", "required": ["segment_id","segment_sequence","segment_hash"] } } } }
  ]
}
